{
  "schema_version": 1,
  "interface_hash": "",
  "nodes": [
    {
      "id": "cairn",
      "kind": "system",
      "name": "Cairn",
      "state": "synced",
      "paths": [],
      "files": [],
      "contracts": [],
      "symbols": []
    },
    {
      "id": "cairn.code-reconciler",
      "kind": "module",
      "name": "CodeReconciler",
      "state": "synced",
      "paths": [],
      "files": [],
      "contracts": [
        "./meta/contracts/reconcilers/code.md"
      ],
      "symbols": []
    },
    {
      "id": "cairn.kernel",
      "kind": "container",
      "name": "Kernel",
      "state": "synced",
      "paths": [],
      "files": [],
      "contracts": [],
      "symbols": []
    },
    {
      "id": "cairn.kernel.artefacts",
      "kind": "module",
      "name": "Artefacts",
      "state": "synced",
      "paths": [],
      "files": [],
      "contracts": [
        "./meta/contracts/kernel/artefacts.md"
      ],
      "symbols": []
    },
    {
      "id": "cairn.kernel.changes",
      "kind": "module",
      "name": "Changes",
      "state": "synced",
      "paths": [],
      "files": [],
      "contracts": [
        "./meta/contracts/kernel/changes.md"
      ],
      "symbols": []
    },
    {
      "id": "cairn.kernel.cli",
      "kind": "module",
      "name": "CLI",
      "state": "synced",
      "paths": [],
      "files": [],
      "contracts": [
        "./meta/contracts/kernel/cli.md"
      ],
      "symbols": []
    },
    {
      "id": "cairn.kernel.hooks",
      "kind": "module",
      "name": "Hooks",
      "state": "synced",
      "paths": [],
      "files": [],
      "contracts": [
        "./meta/contracts/kernel/hooks.md"
      ],
      "symbols": []
    },
    {
      "id": "cairn.kernel.parser",
      "kind": "module",
      "name": "Parser",
      "state": "synced",
      "paths": [],
      "files": [],
      "contracts": [
        "./meta/contracts/kernel/parser.md"
      ],
      "symbols": []
    },
    {
      "id": "cairn.kernel.query",
      "kind": "module",
      "name": "Query",
      "state": "synced",
      "paths": [],
      "files": [],
      "contracts": [
        "./meta/contracts/kernel/query.md"
      ],
      "symbols": []
    },
    {
      "id": "cairn.kernel.reconciler",
      "kind": "module",
      "name": "Reconciler",
      "state": "synced",
      "paths": [],
      "files": [],
      "contracts": [
        "./meta/contracts/kernel/reconciler.md"
      ],
      "symbols": []
    },
    {
      "id": "cairn.kernel.scanner",
      "kind": "module",
      "name": "Scanner",
      "state": "synced",
      "paths": [],
      "files": [],
      "contracts": [
        "./meta/contracts/kernel/scanner.md"
      ],
      "symbols": []
    },
    {
      "id": "cairn.summariser",
      "kind": "module",
      "name": "Summariser",
      "state": "synced",
      "paths": [],
      "files": [],
      "contracts": [
        "./meta/contracts/summariser.md"
      ],
      "symbols": []
    }
  ],
  "edges": [
    {
      "from": "cairn.code-reconciler",
      "to": "cairn.kernel.reconciler",
      "description": "Implements"
    },
    {
      "from": "cairn.kernel.changes",
      "to": "cairn.kernel.scanner",
      "description": "Validates before archive"
    },
    {
      "from": "cairn.kernel.cli",
      "to": "cairn.kernel.query",
      "description": "Exposes queries as commands"
    },
    {
      "from": "cairn.kernel.hooks",
      "to": "cairn.kernel.scanner",
      "description": "Gates on integrity"
    },
    {
      "from": "cairn.kernel.query",
      "to": "cairn.kernel.scanner",
      "description": "Reads map"
    },
    {
      "from": "cairn.kernel.scanner",
      "to": "cairn.kernel.parser",
      "description": "Consumes parsed blueprint"
    },
    {
      "from": "cairn.kernel.scanner",
      "to": "cairn.kernel.artefacts",
      "description": "Validates artefacts"
    },
    {
      "from": "cairn.kernel.scanner",
      "to": "cairn.kernel.reconciler",
      "description": "Invokes registered reconcilers"
    },
    {
      "from": "cairn.summariser",
      "to": "cairn.kernel.scanner",
      "description": "Proposes contract updates on contradictions"
    }
  ],
  "findings": []
}
